{
  "$id": "https://raw.githubusercontent.com/oakvs/ousd-consent-data/main/schema/vendor.schema.json",
  "title": "Vendor",
  "description": "data/published/vendors/{key}.json (schema version 1.0.0). Generated from packages/consent-schema; do not edit by hand.",
  "$schema": "https://json-schema.org/draft/2020-12/schema",
  "type": "object",
  "properties": {
    "schemaVersion": {
      "type": "string",
      "const": "1.0.0"
    },
    "key": {
      "type": "string"
    },
    "vendorNo": {
      "type": [
        "string",
        "null"
      ]
    },
    "displayName": {
      "type": "string"
    },
    "kind": {
      "anyOf": [
        {
          "type": "string",
          "enum": [
            "individual",
            "organization"
          ]
        },
        {
          "type": "null"
        }
      ]
    },
    "names": {
      "type": "array",
      "items": {
        "type": "string"
      }
    },
    "locations": {
      "type": "array",
      "items": {
        "type": "string"
      }
    },
    "firstSeen": {
      "type": "string",
      "pattern": "^\\d{4}-\\d{2}-\\d{2}$"
    },
    "lastSeen": {
      "type": "string",
      "pattern": "^\\d{4}-\\d{2}-\\d{2}$"
    },
    "approvedTotal": {
      "type": "number"
    },
    "yearlyCapsTotal": {
      "type": "number"
    },
    "revenueTotal": {
      "type": "number"
    },
    "approvedCount": {
      "type": "number"
    },
    "pendingAmounts": {
      "type": "number"
    },
    "fundingSources": {
      "type": "array",
      "items": {
        "type": "string"
      }
    },
    "official": {
      "type": "object",
      "properties": {
        "departments": {
          "type": "array",
          "items": {
            "type": "object",
            "properties": {
              "name": {
                "type": "string"
              },
              "count": {
                "type": "number"
              }
            },
            "required": [
              "name",
              "count"
            ],
            "additionalProperties": false
          }
        },
        "matterTypes": {
          "type": "array",
          "items": {
            "type": "object",
            "properties": {
              "name": {
                "type": "string"
              },
              "count": {
                "type": "number"
              }
            },
            "required": [
              "name",
              "count"
            ],
            "additionalProperties": false
          }
        },
        "resourceSites": {
          "type": "array",
          "items": {
            "type": "string"
          }
        }
      },
      "required": [
        "departments",
        "matterTypes",
        "resourceSites"
      ],
      "additionalProperties": false
    },
    "taxonomy": {
      "type": "object",
      "properties": {
        "categories": {
          "type": "array",
          "items": {
            "type": "object",
            "properties": {
              "name": {
                "type": "string"
              },
              "count": {
                "type": "number"
              }
            },
            "required": [
              "name",
              "count"
            ],
            "additionalProperties": false
          }
        },
        "actionTypes": {
          "type": "array",
          "items": {
            "type": "object",
            "properties": {
              "name": {
                "type": "string"
              },
              "count": {
                "type": "number"
              }
            },
            "required": [
              "name",
              "count"
            ],
            "additionalProperties": false
          }
        }
      },
      "required": [
        "categories",
        "actionTypes"
      ],
      "additionalProperties": false
    },
    "appearances": {
      "type": "array",
      "items": {
        "type": "object",
        "properties": {
          "id": {
            "type": "string"
          },
          "meetingKey": {
            "type": "string",
            "pattern": "^\\d{4}-\\d{2}-\\d{2}(-[a-z]+)?$"
          },
          "date": {
            "type": "string",
            "pattern": "^\\d{4}-\\d{2}-\\d{2}$"
          },
          "file": {
            "type": "string"
          },
          "matterId": {
            "type": "number"
          },
          "agendaNumber": {
            "type": "string"
          },
          "title": {
            "type": "string"
          },
          "headline": {
            "type": [
              "string",
              "null"
            ]
          },
          "enriched": {
            "type": "boolean"
          },
          "category": {
            "anyOf": [
              {
                "type": "string",
                "enum": [
                  "Special education",
                  "Classroom & academic programs",
                  "After-school & summer programs",
                  "Student health, support & family services",
                  "School buildings & construction",
                  "Food, transportation & operations",
                  "Technology",
                  "Staff & hiring",
                  "Legal, insurance & risk",
                  "School plans",
                  "Partnerships & data sharing",
                  "Governance & board business"
                ]
              },
              {
                "type": "null"
              }
            ]
          },
          "actionType": {
            "anyOf": [
              {
                "type": "string",
                "enum": [
                  "new_agreement",
                  "amendment",
                  "change_order",
                  "bid_award",
                  "cooperative_purchase",
                  "mou_or_data_sharing",
                  "grant_or_funding_in",
                  "school_plan",
                  "personnel",
                  "resolution_or_policy",
                  "termination",
                  "other"
                ]
              },
              {
                "type": "null"
              }
            ]
          },
          "direction": {
            "anyOf": [
              {
                "type": "string",
                "enum": [
                  "expense",
                  "revenue",
                  "decrease",
                  "no_cost"
                ]
              },
              {
                "type": "null"
              }
            ]
          },
          "amountType": {
            "anyOf": [
              {
                "type": "string",
                "enum": [
                  "not_to_exceed",
                  "fixed",
                  "cumulative",
                  "per_year",
                  "sales_cap"
                ]
              },
              {
                "type": "null"
              }
            ]
          },
          "thisAction": {
            "type": [
              "number",
              "null"
            ]
          },
          "newTotal": {
            "type": [
              "number",
              "null"
            ]
          },
          "term": {
            "anyOf": [
              {
                "type": "object",
                "properties": {
                  "start": {
                    "anyOf": [
                      {
                        "type": "string",
                        "pattern": "^\\d{4}-\\d{2}-\\d{2}$"
                      },
                      {
                        "type": "null"
                      }
                    ]
                  },
                  "end": {
                    "anyOf": [
                      {
                        "type": "string",
                        "pattern": "^\\d{4}-\\d{2}-\\d{2}$"
                      },
                      {
                        "type": "null"
                      }
                    ]
                  }
                },
                "required": [
                  "start",
                  "end"
                ],
                "additionalProperties": false
              },
              {
                "type": "null"
              }
            ]
          },
          "fundingSource": {
            "type": [
              "string",
              "null"
            ]
          },
          "outcome": {
            "anyOf": [
              {
                "type": "object",
                "properties": {
                  "action": {
                    "type": "string"
                  },
                  "date": {
                    "type": "string",
                    "pattern": "^\\d{4}-\\d{2}-\\d{2}$"
                  },
                  "meetingEventId": {
                    "type": [
                      "number",
                      "null"
                    ]
                  },
                  "adopted": {
                    "type": "boolean"
                  }
                },
                "required": [
                  "action",
                  "date",
                  "meetingEventId",
                  "adopted"
                ],
                "additionalProperties": false
              },
              {
                "type": "null"
              }
            ]
          },
          "flags": {
            "type": "array",
            "items": {
              "anyOf": [
                {
                  "type": "string",
                  "enum": [
                    "no_competitive_bid",
                    "multi_year",
                    "time_extension_only",
                    "emergency"
                  ]
                },
                {
                  "type": "string",
                  "enum": [
                    "after_work_began",
                    "raises_existing_contract",
                    "previously_delayed",
                    "source_issue",
                    "large_increase",
                    "yearly_cap",
                    "no_total_stated",
                    "pulled_from_consent",
                    "payment_ratification",
                    "grant_application",
                    "budget_allocation"
                  ]
                }
              ]
            }
          },
          "countsTowardTotals": {
            "type": "boolean"
          }
        },
        "required": [
          "id",
          "meetingKey",
          "date",
          "file",
          "matterId",
          "agendaNumber",
          "title",
          "headline",
          "enriched",
          "category",
          "actionType",
          "direction",
          "amountType",
          "thisAction",
          "newTotal",
          "term",
          "fundingSource",
          "outcome",
          "flags",
          "countsTowardTotals"
        ],
        "additionalProperties": false
      }
    },
    "legistarHistory": {
      "type": "array",
      "items": {
        "type": "object",
        "properties": {
          "matterId": {
            "type": "number"
          },
          "file": {
            "type": "string"
          },
          "title": {
            "type": "string"
          },
          "type": {
            "type": [
              "string",
              "null"
            ]
          },
          "status": {
            "type": [
              "string",
              "null"
            ]
          },
          "department": {
            "type": [
              "string",
              "null"
            ]
          },
          "introDate": {
            "anyOf": [
              {
                "type": "string",
                "pattern": "^\\d{4}-\\d{2}-\\d{2}$"
              },
              {
                "type": "null"
              }
            ]
          },
          "agendaDate": {
            "anyOf": [
              {
                "type": "string",
                "pattern": "^\\d{4}-\\d{2}-\\d{2}$"
              },
              {
                "type": "null"
              }
            ]
          },
          "passedDate": {
            "anyOf": [
              {
                "type": "string",
                "pattern": "^\\d{4}-\\d{2}-\\d{2}$"
              },
              {
                "type": "null"
              }
            ]
          },
          "enactmentNumber": {
            "type": [
              "string",
              "null"
            ]
          },
          "vendorNo": {
            "type": [
              "string",
              "null"
            ]
          },
          "fundingSource": {
            "type": [
              "string",
              "null"
            ]
          },
          "resourceSite": {
            "type": [
              "string",
              "null"
            ]
          },
          "legistarUrl": {
            "type": "string",
            "format": "uri"
          },
          "relatedMatterIds": {
            "type": "array",
            "items": {
              "type": "number"
            }
          }
        },
        "required": [
          "matterId",
          "file",
          "title",
          "type",
          "status",
          "department",
          "introDate",
          "agendaDate",
          "passedDate",
          "enactmentNumber",
          "vendorNo",
          "fundingSource",
          "resourceSite",
          "legistarUrl",
          "relatedMatterIds"
        ],
        "additionalProperties": false
      }
    },
    "profile": {
      "anyOf": [
        {
          "type": "object",
          "properties": {
            "legalName": {
              "type": [
                "string",
                "null"
              ]
            },
            "summary": {
              "type": "string"
            },
            "orgType": {
              "anyOf": [
                {
                  "type": "string",
                  "enum": [
                    "nonprofit",
                    "company",
                    "public_agency",
                    "other"
                  ]
                },
                {
                  "type": "null"
                }
              ]
            },
            "website": {
              "anyOf": [
                {
                  "type": "string",
                  "format": "uri"
                },
                {
                  "type": "null"
                }
              ]
            },
            "phone": {
              "type": [
                "string",
                "null"
              ]
            },
            "email": {
              "type": [
                "string",
                "null"
              ]
            },
            "address": {
              "type": [
                "string",
                "null"
              ]
            },
            "headquarters": {
              "type": [
                "string",
                "null"
              ]
            },
            "ein": {
              "anyOf": [
                {
                  "type": "string",
                  "pattern": "^\\d{2}-\\d{7}$"
                },
                {
                  "type": "null"
                }
              ]
            },
            "caEntityNumber": {
              "type": [
                "string",
                "null"
              ]
            },
            "samUei": {
              "type": [
                "string",
                "null"
              ]
            },
            "sources": {
              "type": "array",
              "items": {
                "type": "object",
                "properties": {
                  "url": {
                    "type": "string",
                    "format": "uri"
                  },
                  "title": {
                    "type": "string"
                  },
                  "supports": {
                    "type": "array",
                    "items": {
                      "type": "string",
                      "enum": [
                        "legalName",
                        "summary",
                        "orgType",
                        "website",
                        "phone",
                        "email",
                        "address",
                        "headquarters",
                        "ein",
                        "caEntityNumber",
                        "samUei"
                      ]
                    }
                  }
                },
                "required": [
                  "url",
                  "title",
                  "supports"
                ],
                "additionalProperties": false
              }
            },
            "researchedAt": {
              "type": "string",
              "pattern": "^\\d{4}-\\d{2}-\\d{2}$"
            },
            "modelId": {
              "type": "string"
            }
          },
          "required": [
            "summary",
            "sources",
            "researchedAt",
            "modelId"
          ],
          "additionalProperties": false
        },
        {
          "type": "null"
        }
      ]
    }
  },
  "required": [
    "schemaVersion",
    "key",
    "vendorNo",
    "displayName",
    "kind",
    "names",
    "locations",
    "firstSeen",
    "lastSeen",
    "approvedTotal",
    "yearlyCapsTotal",
    "revenueTotal",
    "approvedCount",
    "pendingAmounts",
    "fundingSources",
    "official",
    "taxonomy",
    "appearances",
    "legistarHistory",
    "profile"
  ],
  "additionalProperties": false
}
