{
  "appearances": [
    {
      "actionType": "new_agreement",
      "agendaNumber": "O.-40",
      "amountType": "not_to_exceed",
      "category": "After-school & summer programs",
      "countsTowardTotals": true,
      "date": "2025-10-08",
      "direction": "expense",
      "enriched": true,
      "file": "25-2315",
      "flags": [
        "after_work_began"
      ],
      "fundingSource": "Measure G, Parcel Tax",
      "headline": "Approves up to $80,000 for DB Luv LLC to expand sports for students with disabilities",
      "id": "2025-10-08:25-2315",
      "matterId": 66651,
      "meetingKey": "2025-10-08",
      "newTotal": null,
      "outcome": {
        "action": "Adopted on the General Consent Report",
        "adopted": true,
        "date": "2025-10-08",
        "meetingEventId": 5631
      },
      "term": {
        "end": "2026-06-30",
        "start": "2025-09-15"
      },
      "thisAction": 80000,
      "title": "Services Agreement 2025-2026 - DB Luv LLC - Oakland Athletic League"
    }
  ],
  "approvedCount": 1,
  "approvedTotal": 80000,
  "displayName": "DB Luv LLC",
  "firstSeen": "2025-10-08",
  "fundingSources": [
    "Measure G, Parcel Tax"
  ],
  "key": "n-db-luv",
  "kind": null,
  "lastSeen": "2025-10-08",
  "legistarHistory": [
    {
      "agendaDate": "2025-10-08",
      "department": "Chief Academic Officer",
      "enactmentNumber": "25-1725",
      "file": "25-2315",
      "fundingSource": "Measure G, Parcel Tax",
      "introDate": "2025-09-12",
      "legistarUrl": "https://ousd.legistar.com/LegislationDetail.aspx?ID=66651&GUID=5D7E049D-9F56-4BC5-9C2B-3BDB356205D2",
      "matterId": 66651,
      "passedDate": "2025-10-08",
      "relatedMatterIds": [],
      "resourceSite": null,
      "status": "Passed",
      "title": "Services Agreement 2025-2026 - DB Luv LLC - Oakland Athletic League",
      "type": "Agreement or Contract",
      "vendorNo": null
    }
  ],
  "locations": [
    "Oakland, CA"
  ],
  "names": [
    "DB Luv LLC"
  ],
  "official": {
    "departments": [
      {
        "count": 1,
        "name": "Chief Academic Officer"
      }
    ],
    "matterTypes": [
      {
        "count": 1,
        "name": "Agreement or Contract"
      }
    ],
    "resourceSites": []
  },
  "pendingAmounts": 0,
  "profile": null,
  "revenueTotal": 0,
  "schemaVersion": "1.0.0",
  "taxonomy": {
    "actionTypes": [
      {
        "count": 1,
        "name": "new_agreement"
      }
    ],
    "categories": [
      {
        "count": 1,
        "name": "After-school & summer programs"
      }
    ]
  },
  "vendorNo": null,
  "yearlyCapsTotal": 0
}
