{
  "appearances": [
    {
      "actionType": "new_agreement",
      "agendaNumber": "O.-88",
      "amountType": "not_to_exceed",
      "category": "Governance & board business",
      "countsTowardTotals": true,
      "date": "2025-09-24",
      "direction": "expense",
      "enriched": true,
      "file": "25-2187",
      "flags": [
        "after_work_began"
      ],
      "fundingSource": null,
      "headline": "Pays CA Charter Authorizing Professionals up to $17,550 for advice on charter school fiscal oversight",
      "id": "2025-09-24:25-2187",
      "matterId": 66523,
      "meetingKey": "2025-09-24",
      "newTotal": null,
      "outcome": {
        "action": "Adopted on the General Consent Report",
        "adopted": true,
        "date": "2025-09-24",
        "meetingEventId": 5630
      },
      "term": {
        "end": "2026-06-30",
        "start": "2025-07-01"
      },
      "thisAction": 17550,
      "title": "Services Agreement 2025-2026 - CA Charter Authorizing Professionals - Charter Schools Office"
    }
  ],
  "approvedCount": 1,
  "approvedTotal": 17550,
  "displayName": "CA Charter Authorizing Professionals",
  "firstSeen": "2025-09-24",
  "fundingSources": [],
  "key": "n-ca-charter-authorizing-professionals",
  "kind": "organization",
  "lastSeen": "2025-09-24",
  "legistarHistory": [
    {
      "agendaDate": "2025-09-24",
      "department": "General Counsel",
      "enactmentNumber": "25-1654",
      "file": "25-2187",
      "fundingSource": null,
      "introDate": "2025-08-29",
      "legistarUrl": "https://ousd.legistar.com/LegislationDetail.aspx?ID=66523&GUID=4C2577E8-9154-4415-BEFC-09873A179CC3",
      "matterId": 66523,
      "passedDate": "2025-09-24",
      "relatedMatterIds": [],
      "resourceSite": null,
      "status": "Passed",
      "title": "Services Agreement 2025-2026 - CA Charter Authorizing Professionals - Charter Schools Office",
      "type": "Agreement or Contract",
      "vendorNo": null
    }
  ],
  "locations": [
    "Rocklin, CA"
  ],
  "names": [
    "CA Charter Authorizing Professionals"
  ],
  "official": {
    "departments": [
      {
        "count": 1,
        "name": "General Counsel"
      }
    ],
    "matterTypes": [
      {
        "count": 1,
        "name": "Agreement or Contract"
      }
    ],
    "resourceSites": []
  },
  "pendingAmounts": 0,
  "profile": {
    "address": "2351 Sunset Blvd., Ste 170, #859, Rocklin, CA 95765",
    "ein": "47-3234553",
    "email": "info@calauthorizers.org",
    "headquarters": "Rocklin, CA",
    "legalName": "California Charter Authorizing Professionals",
    "modelId": "sonnet-agent",
    "orgType": "nonprofit",
    "phone": "916-244-3520",
    "researchedAt": "2026-10-01",
    "sources": [
      {
        "supports": [
          "legalName",
          "ein",
          "orgType",
          "headquarters"
        ],
        "title": "California Charter Authorizing Professionals - Nonprofit Explorer - ProPublica",
        "url": "https://projects.propublica.org/nonprofits/organizations/473234553"
      },
      {
        "supports": [
          "phone",
          "email",
          "address",
          "headquarters",
          "website"
        ],
        "title": "Contact - California Charter Authorizing Professionals",
        "url": "https://calauthorizers.org/contact"
      },
      {
        "supports": [
          "summary",
          "website"
        ],
        "title": "About - California Charter Authorizing Professionals",
        "url": "https://calauthorizers.org/about"
      }
    ],
    "summary": "A professional membership organization, founded in 2013 by charter school authorizing staff from school districts and county offices of education, that supports the people who oversee charter schools in California. It offers consulting, training, toolkits for reviewing charter petitions and annual reports, webinars and an annual conference.",
    "website": "https://calauthorizers.org"
  },
  "revenueTotal": 0,
  "schemaVersion": "1.0.0",
  "taxonomy": {
    "actionTypes": [
      {
        "count": 1,
        "name": "new_agreement"
      }
    ],
    "categories": [
      {
        "count": 1,
        "name": "Governance & board business"
      }
    ]
  },
  "vendorNo": null,
  "yearlyCapsTotal": 0
}
