{
  "appearances": [
    {
      "actionType": "new_agreement",
      "agendaNumber": "P.-5",
      "amountType": "not_to_exceed",
      "category": "Technology",
      "countsTowardTotals": true,
      "date": "2019-12-11",
      "direction": "expense",
      "enriched": true,
      "file": "19-2458",
      "flags": [
        "after_work_began"
      ],
      "fundingSource": null,
      "headline": "Pays a consultant up to $34,887 to support the 1 Million Project and state broadband grants",
      "id": "2019-12-11:19-2458",
      "matterId": 48368,
      "meetingKey": "2019-12-11",
      "newTotal": null,
      "outcome": {
        "action": "Adopted on the General Consent Report",
        "adopted": true,
        "date": "2019-12-11",
        "meetingEventId": 4501
      },
      "term": {
        "end": "2020-06-30",
        "start": "2019-12-01"
      },
      "thisAction": 34887,
      "title": "Professional Services Contract - Kyleigh Nevis - Technology Services"
    },
    {
      "actionType": "new_agreement",
      "agendaNumber": "P.-1",
      "amountType": "not_to_exceed",
      "category": "Technology",
      "countsTowardTotals": true,
      "date": "2020-05-13",
      "direction": "expense",
      "enriched": true,
      "file": "20-0734",
      "flags": [
        "after_work_began"
      ],
      "fundingSource": null,
      "headline": "Pays a contractor up to $30,000 to coordinate student device and internet access for distance learning",
      "id": "2020-05-13:20-0734",
      "matterId": 49322,
      "meetingKey": "2020-05-13",
      "newTotal": null,
      "outcome": {
        "action": "Adopted on the General Consent Report",
        "adopted": true,
        "date": "2020-05-13",
        "meetingEventId": 4590
      },
      "term": {
        "end": "2020-06-30",
        "start": "2020-03-31"
      },
      "thisAction": 30000,
      "title": "Professional Services Contract - Kyleigh Nevis - Technology Services Department"
    },
    {
      "actionType": "new_agreement",
      "agendaNumber": "V.-4",
      "amountType": "not_to_exceed",
      "category": "Technology",
      "countsTowardTotals": true,
      "date": "2021-05-26",
      "direction": "expense",
      "enriched": true,
      "file": "21-1159",
      "flags": [
        "after_work_began"
      ],
      "fundingSource": "GP",
      "headline": "Ratifies up to $20,123.44 for a contractor to coordinate student device and internet access",
      "id": "2021-05-26:21-1159",
      "matterId": 52295,
      "meetingKey": "2021-05-26",
      "newTotal": null,
      "outcome": {
        "action": "Adopted on the General Consent Report",
        "adopted": true,
        "date": "2021-05-26",
        "meetingEventId": 4797
      },
      "term": {
        "end": "2021-06-30",
        "start": "2021-04-01"
      },
      "thisAction": 20123.44,
      "title": "Professional Services Agreement 2020-2021 - Kyleigh Nevis - Technology Services Department"
    }
  ],
  "approvedCount": 3,
  "approvedTotal": 85010.44,
  "displayName": "Individual contractor (vendor no. 005826)",
  "firstSeen": "2019-12-11",
  "fundingSources": [
    "GP"
  ],
  "key": "v-005826",
  "kind": "individual",
  "lastSeen": "2021-05-26",
  "legistarHistory": [
    {
      "agendaDate": "2021-05-26",
      "department": "Superintendent",
      "enactmentNumber": "21-0830",
      "file": "21-1159",
      "fundingSource": "GP",
      "introDate": "2021-04-30",
      "legistarUrl": "https://ousd.legistar.com/gateway.aspx?M=L&ID=52295",
      "matterId": 52295,
      "passedDate": "2021-05-26",
      "relatedMatterIds": [],
      "resourceSite": "0000-986",
      "status": "Passed",
      "title": "Professional Services Agreement 2020-2021 - Kyleigh Nevis - Technology Services Department",
      "type": "Agreement or Contract",
      "vendorNo": "005826"
    },
    {
      "agendaDate": "2020-05-13",
      "department": "Chief Systems and Services Officer",
      "enactmentNumber": "20-0579",
      "file": "20-0734",
      "fundingSource": null,
      "introDate": "2020-04-08",
      "legistarUrl": "https://ousd.legistar.com/gateway.aspx?M=L&ID=49322",
      "matterId": 49322,
      "passedDate": "2020-05-13",
      "relatedMatterIds": [],
      "resourceSite": "0000-986",
      "status": "Passed",
      "title": "Professional Services Contract - Kyleigh Nevis - Technology Services Department",
      "type": "Agreement or Contract",
      "vendorNo": "005826"
    },
    {
      "agendaDate": "2019-12-11",
      "department": "Chief Systems and Services Officer",
      "enactmentNumber": "19-1766",
      "file": "19-2458",
      "fundingSource": null,
      "introDate": "2019-11-19",
      "legistarUrl": "https://ousd.legistar.com/gateway.aspx?M=L&ID=48368",
      "matterId": 48368,
      "passedDate": "2019-12-11",
      "relatedMatterIds": [],
      "resourceSite": "9135-986",
      "status": "Passed",
      "title": "Professional Services Contract - Kyleigh Nevis - Technology Services",
      "type": "Agreement or Contract",
      "vendorNo": "005826"
    }
  ],
  "locations": [
    "Alameda, CA",
    "Long Beach, CA"
  ],
  "names": [
    "Kyleigh Nevis"
  ],
  "official": {
    "departments": [
      {
        "count": 2,
        "name": "Chief Systems and Services Officer"
      },
      {
        "count": 1,
        "name": "Superintendent"
      }
    ],
    "matterTypes": [
      {
        "count": 3,
        "name": "Agreement or Contract"
      }
    ],
    "resourceSites": [
      "0000-986",
      "9135-986"
    ]
  },
  "pendingAmounts": 0,
  "profile": null,
  "revenueTotal": 0,
  "schemaVersion": "1.0.0",
  "taxonomy": {
    "actionTypes": [
      {
        "count": 3,
        "name": "new_agreement"
      }
    ],
    "categories": [
      {
        "count": 3,
        "name": "Technology"
      }
    ]
  },
  "vendorNo": "005826",
  "yearlyCapsTotal": 0
}
