{
  "appearances": [
    {
      "actionType": "new_agreement",
      "agendaNumber": "P.-27",
      "amountType": "not_to_exceed",
      "category": "Student health, support & family services",
      "countsTowardTotals": true,
      "date": "2020-02-12",
      "direction": "expense",
      "enriched": true,
      "file": "20-0070",
      "flags": [
        "after_work_began"
      ],
      "fundingSource": "Kaiser Health&wellness W/ebcf",
      "headline": "Ratifies up to $3,600 for Bounce Back Generation's life skills workshops for parents",
      "id": "2020-02-12:20-0070",
      "matterId": 48669,
      "meetingKey": "2020-02-12",
      "newTotal": null,
      "outcome": {
        "action": "Adopted on the General Consent Report",
        "adopted": true,
        "date": "2020-02-12",
        "meetingEventId": 4537
      },
      "term": {
        "end": "2020-05-29",
        "start": "2019-09-02"
      },
      "thisAction": 3600,
      "title": "Professional Services Contract - Bounce Back Generation - Community Schools and Student Services Department"
    },
    {
      "actionType": "new_agreement",
      "agendaNumber": "V.-15",
      "amountType": "not_to_exceed",
      "category": "Student health, support & family services",
      "countsTowardTotals": true,
      "date": "2020-11-12",
      "direction": "expense",
      "enriched": true,
      "file": "20-2067",
      "flags": [
        "after_work_began"
      ],
      "fundingSource": "Homeless Children & Youth",
      "headline": "Ratifies up to $3,600 for Bounce Back Generation workshops for families without housing",
      "id": "2020-11-12:20-2067",
      "matterId": 50649,
      "meetingKey": "2020-11-12",
      "newTotal": null,
      "outcome": {
        "action": "Adopted on the General Consent Report",
        "adopted": true,
        "date": "2020-11-12",
        "meetingEventId": 4675
      },
      "term": {
        "end": "2020-10-30",
        "start": "2020-08-19"
      },
      "thisAction": 3600,
      "title": "Professional Services Agreement 2020-2021 - Bounce Back Generation - Community Schools and Student Services Department"
    }
  ],
  "approvedCount": 2,
  "approvedTotal": 7200,
  "displayName": "Bounce Back Generation",
  "firstSeen": "2020-02-12",
  "fundingSources": [
    "Homeless Children & Youth",
    "Kaiser Health&wellness W/ebcf"
  ],
  "key": "v-006174",
  "kind": "organization",
  "lastSeen": "2020-11-12",
  "legistarHistory": [
    {
      "agendaDate": "2021-06-30",
      "department": "Chief Academic Officer",
      "enactmentNumber": "21-1245",
      "file": "21-1571",
      "fundingSource": "Homeless Children & Youth",
      "introDate": "2021-06-04",
      "legistarUrl": "https://ousd.legistar.com/gateway.aspx?M=L&ID=52707",
      "matterId": 52707,
      "passedDate": "2021-06-30",
      "relatedMatterIds": [
        50649
      ],
      "resourceSite": "5630-922",
      "status": "Passed",
      "title": "Amendment No. 1, Professional Services Agreement - Bounce Back Generation - Community Schools and Student Services Department",
      "type": "Agreement or Contract",
      "vendorNo": "006174"
    },
    {
      "agendaDate": "2020-11-12",
      "department": "Chief Academic Officer",
      "enactmentNumber": "20-1649",
      "file": "20-2067",
      "fundingSource": "Homeless Children & Youth",
      "introDate": "2020-10-13",
      "legistarUrl": "https://ousd.legistar.com/gateway.aspx?M=L&ID=50649",
      "matterId": 50649,
      "passedDate": "2020-11-12",
      "relatedMatterIds": [
        52707
      ],
      "resourceSite": "5630-922",
      "status": "Passed",
      "title": "Professional Services Agreement 2020-2021 - Bounce Back Generation - Community Schools and Student Services Department",
      "type": "Agreement or Contract",
      "vendorNo": "006174"
    },
    {
      "agendaDate": "2020-02-12",
      "department": "Chief Academic Officer",
      "enactmentNumber": "20-0206",
      "file": "20-0070",
      "fundingSource": "Kaiser Health&wellness W/ebcf",
      "introDate": "2020-01-08",
      "legistarUrl": "https://ousd.legistar.com/gateway.aspx?M=L&ID=48669",
      "matterId": 48669,
      "passedDate": "2020-02-12",
      "relatedMatterIds": [],
      "resourceSite": "9225-922",
      "status": "Passed",
      "title": "Professional Services Contract - Bounce Back Generation - Community Schools and Student Services Department",
      "type": "Agreement or Contract",
      "vendorNo": "006174"
    }
  ],
  "locations": [
    "Alameda, CA",
    "Oakland, CA"
  ],
  "names": [
    "Bounce Back Generation"
  ],
  "official": {
    "departments": [
      {
        "count": 3,
        "name": "Chief Academic Officer"
      }
    ],
    "matterTypes": [
      {
        "count": 3,
        "name": "Agreement or Contract"
      }
    ],
    "resourceSites": [
      "5630-922",
      "9225-922"
    ]
  },
  "pendingAmounts": 0,
  "profile": {
    "ein": "84-2436513",
    "headquarters": "Alameda, CA",
    "legalName": "Bounce Back Generation Inc",
    "modelId": "sonnet-agent",
    "orgType": "nonprofit",
    "researchedAt": "2026-10-04",
    "sources": [
      {
        "supports": [
          "legalName",
          "ein",
          "headquarters",
          "orgType"
        ],
        "title": "Bounce Back Generation Inc - Nonprofit Explorer - ProPublica",
        "url": "https://projects.propublica.org/nonprofits/organizations/842436513"
      },
      {
        "supports": [
          "summary",
          "website",
          "orgType"
        ],
        "title": "Bounce Back Generation",
        "url": "https://www.bouncebackgeneration.org/"
      }
    ],
    "summary": "A nonprofit that teaches resilience skills to young people through science-based media and programs. Its content helps youth understand their nervous systems, interrupt negative thought patterns and cope with stress and trauma. It began in 2011 with community work in San Francisco and became a registered 501(c)(3) nonprofit in 2019.",
    "website": "https://www.bouncebackgeneration.org/"
  },
  "revenueTotal": 0,
  "schemaVersion": "1.0.0",
  "taxonomy": {
    "actionTypes": [
      {
        "count": 2,
        "name": "new_agreement"
      }
    ],
    "categories": [
      {
        "count": 2,
        "name": "Student health, support & family services"
      }
    ]
  },
  "vendorNo": "006174",
  "yearlyCapsTotal": 0
}
